{
  "contract_version": "1",
  "conversations": [{
    "id": "13333333-3333-4333-8333-333333333333",
    "workspace_id": "11111111-1111-4111-8111-111111111112",
    "source": "email",
    "external_id": "EMAIL-7",
    "text": "My qualifying order is missing from order history.",
    "created_at": "2026-09-12T13:00:00Z"
  }],
  "documents": [],
  "existing_issues": [],
  "groups": [{
    "id": "15555555-5555-4555-8555-555555555555",
    "workspace_id": "11111111-1111-4111-8111-111111111112",
    "conversation_ids": ["13333333-3333-4333-8333-333333333333"],
    "claim": "A qualifying order is absent from order history.",
    "prerequisites": ["Access to order history"],
    "unknowns": ["The account could not open order history."]
  }],
  "evidence": [{
    "id": "16666666-6666-4666-8666-666666666666",
    "job_id": "12222222-2222-4222-8222-222222222222",
    "workspace_id": "11111111-1111-4111-8111-111111111112",
    "session_id": "1aaaaaaa-aaaa-4aaa-8aaa-aaaaaaaaaaac",
    "kind": "dom",
    "created_at": "2026-09-12T13:01:00Z",
    "storage_key": "workspaces/11111111-1111-4111-8111-111111111112/jobs/12222222-2222-4222-8222-222222222222/evidence/16666666-6666-4666-8666-666666666666",
    "sha256": "cccccccccccccccccccccccccccccccccccccccccccccccccccccccccccccccc",
    "mime_type": "text/plain",
    "summary": "Order history returned an access-denied message.",
    "document_id": null,
    "quote": null
  }],
  "events": [{
    "id": "18888888-8888-4888-8888-888888888888",
    "job_id": "12222222-2222-4222-8222-222222222222",
    "workspace_id": "11111111-1111-4111-8111-111111111112",
    "sequence": 1,
    "created_at": "2026-09-12T13:01:00Z",
    "kind": "warning",
    "message": "Investigation blocked by missing order-history access.",
    "evidence_ids": ["16666666-6666-4666-8666-666666666666"]
  }],
  "reports": [{
    "id": "19999999-9999-4999-8999-999999999999",
    "job_id": "12222222-2222-4222-8222-222222222222",
    "workspace_id": "11111111-1111-4111-8111-111111111112",
    "group_id": "15555555-5555-4555-8555-555555555555",
    "title": "Order-history complaint needs access",
    "outcome": "blocked",
    "interpretation": "unresolved",
    "source_conversation_ids": ["13333333-3333-4333-8333-333333333333"],
    "expected": {
      "text": "The reported order would appear if it qualifies for the selected filters.",
      "document_ids": [],
      "assumption": true
    },
    "actual": {
      "text": "Order contents and filters could not be inspected.",
      "evidence_ids": ["16666666-6666-4666-8666-666666666666"]
    },
    "steps": [{
      "action": "Open order history.",
      "observation": "Access was denied.",
      "evidence_ids": ["16666666-6666-4666-8666-666666666666"]
    }],
    "attempts": [{
      "session_id": "1aaaaaaa-aaaa-4aaa-8aaa-aaaaaaaaaaac",
      "result": "Blocked before order data was displayed.",
      "evidence_ids": ["16666666-6666-4666-8666-666666666666"]
    }],
    "duplicate_candidates": [],
    "limitations": ["The complaint could not be evaluated without order-history access."],
    "proposed_acceptance_checks": ["A permitted account can view its qualifying orders."],
    "evidence_ids": ["16666666-6666-4666-8666-666666666666"],
    "replay_status": "not_run"
  }],
  "jobs": [{
    "id": "12222222-2222-4222-8222-222222222222",
    "workspace_id": "11111111-1111-4111-8111-111111111112",
    "status": "completed",
    "created_at": "2026-09-12T13:00:00Z",
    "updated_at": "2026-09-12T13:02:00Z",
    "deadline_at": "2026-09-12T13:10:00Z",
    "input": {
      "conversation_ids": ["13333333-3333-4333-8333-333333333333"],
      "max_groups": 1,
      "seed_version": 1
    },
    "group_ids": ["15555555-5555-4555-8555-555555555555"],
    "report_ids": ["19999999-9999-4999-8999-999999999999"],
    "error": null,
    "metrics": {
      "model_calls": 3,
      "browser_actions": 2,
      "input_tokens": 900,
      "output_tokens": 250,
      "duration_ms": 15000,
      "estimated_model_cost_usd_micros": null
    }
  }]
}
